{"$schema":"./tajenka-content.schema.json","schemaVersion":2,"bankId":"tajenka-v2-editorial-observation-2026-09-10","runtimeEnabled":false,"status":"editorial-approved-structural-dry-pass","notes":["Authoring-only observation shard; not imported by runtime."],"candidates":[{"id":"tajenka-v2-c01","candidateNo":1,"category":"observation","displayText":"Nové bílé tričko přitahuje omáčku.","immutable":false,"anchors":[{"surface":"NOVÉ","suitability":"strong"},{"surface":"BÍLÉ","suitability":"strong"},{"surface":"TRIČKO","suitability":"strong"},{"surface":"PŘITAHUJE","suitability":"strong"},{"surface":"OMÁČKU","suitability":"strong"}],"companions":[],"expectedValidation":"pass"},{"id":"tajenka-v2-c03","candidateNo":3,"category":"observation","displayText":"Ticho v bytě s dětmi bývá podezřelé.","immutable":false,"anchors":[{"surface":"TICHO","suitability":"strong"},{"surface":"BYTĚ","suitability":"strong"},{"surface":"DĚTMI","suitability":"strong"},{"surface":"BÝVÁ","suitability":"strong"},{"surface":"PODEZŘELÉ","suitability":"strong"}],"companions":[{"text":"v","revealWith":"BYTĚ","significant":false},{"text":"s","revealWith":"DĚTMI","significant":false}],"expectedValidation":"pass"},{"id":"tajenka-v2-c04","candidateNo":4,"category":"observation","displayText":"Fronta se pohne hned, když odejdeš vedle.","immutable":false,"anchors":[{"surface":"FRONTA","suitability":"strong"},{"surface":"POHNE","suitability":"strong"},{"surface":"HNED","suitability":"strong"},{"surface":"ODEJDEŠ","suitability":"strong"},{"surface":"VEDLE","suitability":"strong"}],"companions":[{"text":"se","revealWith":"POHNE","significant":false},{"text":"když","revealWith":"ODEJDEŠ","significant":false}],"expectedValidation":"pass"},{"id":"tajenka-v2-c06","candidateNo":6,"category":"observation","displayText":"Prázdná krabice od bot vydrží doma roky.","immutable":false,"anchors":[{"surface":"PRÁZDNÁ","suitability":"strong"},{"surface":"KRABICE","suitability":"strong"},{"surface":"VYDRŽÍ","suitability":"strong"},{"surface":"DOMA","suitability":"strong"},{"surface":"ROKY","suitability":"strong"}],"companions":[{"text":"od bot","revealWith":"KRABICE","significant":true}],"expectedValidation":"pass"},{"id":"tajenka-v2-c10","candidateNo":10,"category":"observation","displayText":"Myčka na nádobí tajně jí lžičky k snídani.","immutable":false,"anchors":[{"surface":"MYČKA","suitability":"strong"},{"surface":"NÁDOBÍ","suitability":"strong"},{"surface":"TAJNĚ","suitability":"strong"},{"surface":"LŽIČKY","suitability":"strong"},{"surface":"SNÍDANI","suitability":"strong"}],"companions":[{"text":"na","revealWith":"NÁDOBÍ","significant":false},{"text":"jí","revealWith":"LŽIČKY","significant":false},{"text":"k","revealWith":"SNÍDANI","significant":false}],"expectedValidation":"pass"},{"id":"tajenka-v2-c11","candidateNo":11,"category":"observation","displayText":"Když má deštník největší cenu, zůstane doma.","immutable":false,"anchors":[{"surface":"DEŠTNÍK","suitability":"strong"},{"surface":"NEJVĚTŠÍ","suitability":"strong"},{"surface":"CENU","suitability":"strong"},{"surface":"ZŮSTANE","suitability":"strong"},{"surface":"DOMA","suitability":"strong"}],"companions":[{"text":"Když","revealWith":"DEŠTNÍK","significant":false},{"text":"má","revealWith":"NEJVĚTŠÍ","significant":false}],"expectedValidation":"pass"},{"id":"tajenka-v2-c12","candidateNo":12,"category":"observation","displayText":"Zavřené dveře jsou pro kočku osobní útok.","immutable":false,"anchors":[{"surface":"ZAVŘENÉ","suitability":"strong"},{"surface":"DVEŘE","suitability":"strong"},{"surface":"KOČKU","suitability":"strong"},{"surface":"OSOBNÍ","suitability":"strong"},{"surface":"ÚTOK","suitability":"strong"}],"companions":[{"text":"jsou pro","revealWith":"KOČKU","significant":false}],"expectedValidation":"pass"},{"id":"tajenka-v2-c31","candidateNo":31,"category":"observation","displayText":"Návod oceníš teprve po druhé chybě.","immutable":false,"anchors":[{"surface":"NÁVOD","suitability":"strong"},{"surface":"OCENÍŠ","suitability":"strong"},{"surface":"TEPRVE","suitability":"strong"},{"surface":"DRUHÉ","suitability":"strong"},{"surface":"CHYBĚ","suitability":"strong"}],"companions":[{"text":"po","revealWith":"DRUHÉ","significant":false}],"expectedValidation":"pass"},{"id":"tajenka-v2-c32","candidateNo":32,"category":"observation","displayText":"Staré heslo si vybavíš hned po resetu.","immutable":false,"anchors":[{"surface":"STARÉ","suitability":"strong"},{"surface":"HESLO","suitability":"strong"},{"surface":"VYBAVÍŠ","suitability":"strong"},{"surface":"HNED","suitability":"strong"},{"surface":"RESETU","suitability":"strong"}],"companions":[{"text":"si","revealWith":"VYBAVÍŠ","significant":false},{"text":"po","revealWith":"RESETU","significant":false}],"expectedValidation":"pass"},{"id":"tajenka-v2-c34","candidateNo":34,"category":"observation","displayText":"Lednice v noci nabízí lepší argumenty.","immutable":false,"anchors":[{"surface":"LEDNICE","suitability":"strong"},{"surface":"NOCI","suitability":"strong"},{"surface":"NABÍZÍ","suitability":"strong"},{"surface":"LEPŠÍ","suitability":"strong"},{"surface":"ARGUMENTY","suitability":"strong"}],"companions":[{"text":"v","revealWith":"NOCI","significant":false}],"expectedValidation":"pass"},{"id":"tajenka-v2-c35","candidateNo":35,"category":"observation","displayText":"Výtah přijede přesně, když vezmeš schody.","immutable":false,"anchors":[{"surface":"VÝTAH","suitability":"strong"},{"surface":"PŘIJEDE","suitability":"strong"},{"surface":"PŘESNĚ","suitability":"strong"},{"surface":"VEZMEŠ","suitability":"strong"},{"surface":"SCHODY","suitability":"strong"}],"companions":[{"text":"když","revealWith":"VEZMEŠ","significant":false}],"expectedValidation":"pass"},{"id":"tajenka-v2-c36","candidateNo":36,"category":"observation","displayText":"Káva vystydne vždycky během hovoru.","immutable":false,"anchors":[{"surface":"KÁVA","suitability":"strong"},{"surface":"VYSTYDNE","suitability":"strong"},{"surface":"VŽDYCKY","suitability":"strong"},{"surface":"BĚHEM","suitability":"strong"},{"surface":"HOVORU","suitability":"strong"}],"companions":[],"expectedValidation":"pass"},{"id":"tajenka-v2-c37","candidateNo":37,"category":"observation","displayText":"Čisté prádlo se skládá nejlépe zítra.","immutable":false,"anchors":[{"surface":"ČISTÉ","suitability":"strong"},{"surface":"PRÁDLO","suitability":"strong"},{"surface":"SKLÁDÁ","suitability":"strong"},{"surface":"NEJLÉPE","suitability":"strong"},{"surface":"ZÍTRA","suitability":"strong"}],"companions":[{"text":"se","revealWith":"SKLÁDÁ","significant":false}],"expectedValidation":"pass"},{"id":"tajenka-v2-c38","candidateNo":38,"category":"observation","displayText":"Vysavač najde drobný šroubek dřív než ty.","immutable":false,"anchors":[{"surface":"VYSAVAČ","suitability":"strong"},{"surface":"NAJDE","suitability":"strong"},{"surface":"DROBNÝ","suitability":"strong"},{"surface":"ŠROUBEK","suitability":"strong"},{"surface":"DŘÍV","suitability":"strong"}],"companions":[{"text":"než ty","revealWith":"DŘÍV","significant":false}],"expectedValidation":"pass"},{"id":"tajenka-v2-c39","candidateNo":39,"category":"observation","displayText":"Čerstvě umyté okno přivolá déšť.","immutable":false,"anchors":[{"surface":"ČERSTVĚ","suitability":"strong"},{"surface":"UMYTÉ","suitability":"strong"},{"surface":"OKNO","suitability":"strong"},{"surface":"PŘIVOLÁ","suitability":"strong"},{"surface":"DÉŠŤ","suitability":"strong"}],"companions":[],"expectedValidation":"pass"},{"id":"tajenka-v2-c40","candidateNo":40,"category":"observation","displayText":"Dálkový ovladač bydlí mezi polštáři.","immutable":false,"anchors":[{"surface":"DÁLKOVÝ","suitability":"strong"},{"surface":"OVLADAČ","suitability":"strong"},{"surface":"BYDLÍ","suitability":"strong"},{"surface":"MEZI","suitability":"weak"},{"surface":"POLŠTÁŘI","suitability":"strong"}],"companions":[],"expectedValidation":"fail","notes":"Pátý anchor MEZI je syntaktické lepidlo; běžný autorský text nemá nárok na 4-anchor výjimku."},{"id":"tajenka-v2-c48","candidateNo":48,"category":"observation","displayText":"Rajče v lednici čeká na lepší časy.","immutable":false,"anchors":[{"surface":"RAJČE","suitability":"strong"},{"surface":"LEDNICI","suitability":"strong"},{"surface":"ČEKÁ","suitability":"strong"},{"surface":"LEPŠÍ","suitability":"strong"},{"surface":"ČASY","suitability":"strong"}],"companions":[{"text":"v","revealWith":"LEDNICI","significant":false},{"text":"na","revealWith":"LEPŠÍ","significant":false}],"expectedValidation":"pass"},{"id":"tajenka-v2-c49","candidateNo":49,"category":"observation","displayText":"Banán dozraje ve chvíli, kdy odejdeš z domu.","immutable":false,"anchors":[{"surface":"BANÁN","suitability":"strong"},{"surface":"DOZRAJE","suitability":"strong"},{"surface":"CHVÍLI","suitability":"strong"},{"surface":"ODEJDEŠ","suitability":"strong"},{"surface":"DOMU","suitability":"strong"}],"companions":[{"text":"ve","revealWith":"CHVÍLI","significant":false},{"text":"kdy","revealWith":"ODEJDEŠ","significant":false},{"text":"z","revealWith":"DOMU","significant":false}],"expectedValidation":"pass"},{"id":"tajenka-v2-c58","candidateNo":58,"category":"observation","displayText":"Kabel se zamotá i bez lidského dohledu.","immutable":false,"anchors":[{"surface":"KABEL","suitability":"strong"},{"surface":"ZAMOTÁ","suitability":"strong"},{"surface":"BEZ","suitability":"weak"},{"surface":"LIDSKÉHO","suitability":"strong"},{"surface":"DOHLEDU","suitability":"strong"}],"companions":[{"text":"se","revealWith":"ZAMOTÁ","significant":false},{"text":"i","revealWith":"BEZ","significant":false}],"expectedValidation":"fail","notes":"BEZ by byl slabý třípísmenný funkční anchor; bez něj má autorský text jen čtyři nosné anchory."}]}
