{"$schema":"./tajenka-content.schema.json","schemaVersion":2,"bankId":"tajenka-v2-editorial-proverb-2026-09-10","runtimeEnabled":false,"status":"editorial-approved-structural-dry-pass","notes":["Authoring-only proverb shard; not imported by runtime."],"candidates":[{"id":"tajenka-v2-c29","candidateNo":29,"category":"proverb","displayText":"Lepší vrabec v hrsti než holub na střeše.","immutable":true,"anchors":[{"surface":"LEPŠÍ","suitability":"strong"},{"surface":"VRABEC","suitability":"strong"},{"surface":"HRSTI","suitability":"strong"},{"surface":"HOLUB","suitability":"strong"},{"surface":"STŘEŠE","suitability":"strong"}],"companions":[{"text":"v","revealWith":"HRSTI","significant":false},{"text":"než","revealWith":"HOLUB","significant":false},{"text":"na","revealWith":"STŘEŠE","significant":false}],"expectedValidation":"pass"},{"id":"tajenka-v2-c54","candidateNo":54,"category":"proverb","displayText":"Co můžeš udělat dnes, neodkládej na zítřek.","immutable":true,"anchors":[{"surface":"MŮŽEŠ","suitability":"strong"},{"surface":"UDĚLAT","suitability":"strong"},{"surface":"DNES","suitability":"strong"},{"surface":"NEODKLÁDEJ","suitability":"strong"},{"surface":"ZÍTŘEK","suitability":"strong"}],"companions":[{"text":"Co","revealWith":"MŮŽEŠ","significant":false},{"text":"na","revealWith":"ZÍTŘEK","significant":false}],"expectedValidation":"pass"},{"id":"tajenka-v2-c55","candidateNo":55,"category":"proverb","displayText":"Mluviti stříbro, mlčeti zlato.","immutable":true,"anchors":[{"surface":"MLUVITI","suitability":"strong"},{"surface":"STŘÍBRO","suitability":"strong"},{"surface":"MLČETI","suitability":"strong"},{"surface":"ZLATO","suitability":"strong"}],"companions":[],"expectedValidation":"pass"},{"id":"tajenka-v2-c57","candidateNo":57,"category":"proverb","displayText":"Jablko nepadá daleko od stromu.","immutable":true,"anchors":[{"surface":"JABLKO","suitability":"strong"},{"surface":"NEPADÁ","suitability":"strong"},{"surface":"DALEKO","suitability":"strong"},{"surface":"STROMU","suitability":"strong"}],"companions":[{"text":"od","revealWith":"STROMU","significant":false}],"expectedValidation":"pass"},{"id":"tajenka-v2-c59","candidateNo":59,"category":"proverb","displayText":"Líná huba, holé neštěstí.","immutable":true,"anchors":[{"surface":"LÍNÁ","suitability":"strong"},{"surface":"HUBA","suitability":"strong"},{"surface":"HOLÉ","suitability":"strong"},{"surface":"NEŠTĚSTÍ","suitability":"strong"}],"companions":[],"expectedValidation":"fail","notes":"Jen 20 herních písmen, pod minimem pro 4-anchor výjimku."},{"id":"tajenka-v2-c60","candidateNo":60,"category":"proverb","displayText":"Co je šeptem, to je čertem.","immutable":true,"anchors":[{"surface":"ŠEPTEM","suitability":"strong"},{"surface":"ČERTEM","suitability":"strong"}],"companions":[{"text":"Co je","revealWith":"ŠEPTEM","significant":false},{"text":"to je","revealWith":"ČERTEM","significant":false}],"expectedValidation":"fail","notes":"Pouze dva nosné anchory a 12 herních písmen."}]}
