{"$schema":"./tajenka-content.schema.json","schemaVersion":2,"bankId":"tajenka-v2-editorial-quote-2026-09-10","runtimeEnabled":false,"status":"editorial-approved-structural-dry-pass","notes":["Authoring-only quote shard; not imported by runtime."],"candidates":[{"id":"tajenka-v2-c30","candidateNo":30,"category":"quote","displayText":"„Já každou myšlenku tak dlouho hobluju, až je z ní epigram.“","immutable":true,"anchors":[{"surface":"KAŽDOU","suitability":"strong"},{"surface":"MYŠLENKU","suitability":"strong"},{"surface":"DLOUHO","suitability":"strong"},{"surface":"HOBLUJU","suitability":"strong"},{"surface":"EPIGRAM","suitability":"strong"}],"companions":[{"text":"Já","revealWith":"KAŽDOU","significant":false},{"text":"tak","revealWith":"DLOUHO","significant":false},{"text":"až je","revealWith":"EPIGRAM","significant":false},{"text":"z ní","revealWith":"EPIGRAM","significant":false}],"expectedValidation":"fail","source":{"status":"verified","label":"Wikisource — Karel Havlíček Borovský, Epigramy","url":"https://cs.wikisource.org/wiki/Str%C3%A1nka%3AHavl%C3%AD%C4%8Dek_Borovsk%C3%BD%2C_Karel_-_Epigramy_%281911%29.pdf/12"},"notes":"Redakčně schváleno, ale pět nosných anchorů má 34 písmen."},{"id":"tajenka-v2-c56","candidateNo":56,"category":"quote","displayText":"„Kdo chvíli stál, již stojí opodál.“","immutable":true,"anchors":[{"surface":"KDO","suitability":"strong"},{"surface":"CHVÍLI","suitability":"strong"},{"surface":"STÁL","suitability":"strong"},{"surface":"STOJÍ","suitability":"strong"},{"surface":"OPODÁL","suitability":"strong"}],"companions":[{"text":"již","revealWith":"STOJÍ","significant":false}],"expectedValidation":"pass","shortAnchorJustification":"KDO je významově nezbytnou součástí neměnného citátu a nese herní informaci.","source":{"status":"verified","label":"Wikisource — Jan Neruda, Jen dál!","url":"https://cs.wikisource.org/wiki/Zp%C4%9Bvy_p%C3%A1te%C4%8Dn%C3%AD/Jen_d%C3%A1l%21"}}]}
