{"$schema":"./tajenka-content.schema.json","schemaVersion":2,"bankId":"tajenka-v2-editorial-czech-2026-09-10","runtimeEnabled":false,"status":"editorial-approved-structural-dry-pass","notes":["Authoring-only czech shard; not imported by runtime."],"candidates":[{"id":"tajenka-v2-c26","candidateNo":26,"category":"czech","displayText":"Dolar má přes tolar české kořeny v Jáchymově.","immutable":false,"anchors":[{"surface":"DOLAR","suitability":"strong"},{"surface":"TOLAR","suitability":"strong"},{"surface":"ČESKÉ","suitability":"strong"},{"surface":"KOŘENY","suitability":"strong"},{"surface":"JÁCHYMOVĚ","suitability":"strong"}],"companions":[{"text":"má","revealWith":"DOLAR","significant":false},{"text":"přes","revealWith":"TOLAR","significant":true},{"text":"v","revealWith":"JÁCHYMOVĚ","significant":false}],"expectedValidation":"pass","source":{"status":"verified","label":"Česká národní banka","url":"https://www.cnb.cz/cs/verejnost/servis-pro-media/autorske-clanky-rozhovory-s-predstaviteli-cnb/Historie-penez-00001"}},{"id":"tajenka-v2-c27","candidateNo":27,"category":"czech","displayText":"Kostka cukru vznikla v Dačicích roku 1841.","immutable":false,"anchors":[{"surface":"KOSTKA","suitability":"strong"},{"surface":"CUKRU","suitability":"strong"},{"surface":"VZNIKLA","suitability":"strong"},{"surface":"DAČICÍCH","suitability":"strong"},{"surface":"ROKU","suitability":"strong"}],"companions":[{"text":"v","revealWith":"DAČICÍCH","significant":false},{"text":"1841","revealWith":"ROKU","significant":true}],"expectedValidation":"pass","source":{"status":"verified","label":"Městské muzeum a galerie Dačice","url":"https://muzeumdacice.cz/o-muzeu/expozice/"}},{"id":"tajenka-v2-c28","candidateNo":28,"category":"czech","displayText":"Pražský orloj existuje přes šest století.","immutable":false,"anchors":[{"surface":"PRAŽSKÝ","suitability":"strong"},{"surface":"ORLOJ","suitability":"strong"},{"surface":"EXISTUJE","suitability":"strong"},{"surface":"ŠEST","suitability":"strong"},{"surface":"STOLETÍ","suitability":"strong"}],"companions":[{"text":"přes","revealWith":"ŠEST","significant":false}],"expectedValidation":"pass","source":{"status":"verified","label":"Prague City Tourism","url":"https://prague.eu/en/about-the-old-town-astronomical-clock/"}}]}
