{"$schema":"./tajenka-content.schema.json","schemaVersion":2,"bankId":"tajenka-v2-editorial-fact-2026-09-10","runtimeEnabled":false,"status":"editorial-approved-structural-dry-pass","notes":["Authoring-only fact shard; not imported by runtime."],"candidates":[{"id":"tajenka-v2-c15","candidateNo":15,"category":"fact","displayText":"Chobotnice mají tři srdce a modrou krev.","immutable":false,"anchors":[{"surface":"CHOBOTNICE","suitability":"strong"},{"surface":"MAJÍ","suitability":"strong"},{"surface":"SRDCE","suitability":"strong"},{"surface":"MODROU","suitability":"strong"},{"surface":"KREV","suitability":"strong"}],"companions":[{"text":"tři","revealWith":"SRDCE","significant":true},{"text":"a","revealWith":"MODROU","significant":false}],"expectedValidation":"pass","source":{"status":"verified","label":"Smithsonian Ocean","url":"https://ocean.si.edu/ocean-life/invertebrates/octopuses-squids-and-relatives"}},{"id":"tajenka-v2-c16","candidateNo":16,"category":"fact","displayText":"Vombat opravdu kadí malé kostky.","immutable":false,"anchors":[{"surface":"VOMBAT","suitability":"strong"},{"surface":"OPRAVDU","suitability":"strong"},{"surface":"KADÍ","suitability":"strong"},{"surface":"MALÉ","suitability":"strong"},{"surface":"KOSTKY","suitability":"strong"}],"companions":[],"expectedValidation":"pass","source":{"status":"verified","label":"Georgia Tech College of Sciences","url":"https://biosciences.gatech.edu/node/2512"}},{"id":"tajenka-v2-c17","candidateNo":17,"category":"fact","displayText":"Žraloci jsou starší než první stromy.","immutable":false,"anchors":[{"surface":"ŽRALOCI","suitability":"strong"},{"surface":"JSOU","suitability":"strong"},{"surface":"STARŠÍ","suitability":"strong"},{"surface":"PRVNÍ","suitability":"strong"},{"surface":"STROMY","suitability":"strong"}],"companions":[{"text":"než","revealWith":"PRVNÍ","significant":false}],"expectedValidation":"pass","source":{"status":"verified","label":"Natural History Museum","url":"https://www.nhm.ac.uk/discover/shark-evolution-a-450-million-year-timeline.html"}},{"id":"tajenka-v2-c18","candidateNo":18,"category":"fact","displayText":"Vrány si pamatují lidské tváře celé roky.","immutable":false,"anchors":[{"surface":"VRÁNY","suitability":"strong"},{"surface":"PAMATUJÍ","suitability":"strong"},{"surface":"LIDSKÉ","suitability":"strong"},{"surface":"TVÁŘE","suitability":"strong"},{"surface":"ROKY","suitability":"strong"}],"companions":[{"text":"si","revealWith":"PAMATUJÍ","significant":false},{"text":"celé","revealWith":"ROKY","significant":false}],"expectedValidation":"pass","source":{"status":"verified","label":"University of Washington","url":"https://www.washington.edu/news/2012/09/10/crows-react-to-threats-in-human-like-way/"}},{"id":"tajenka-v2-c19","candidateNo":19,"category":"fact","displayText":"Banán je bobule. Jahoda botanicky není.","immutable":false,"anchors":[{"surface":"BANÁN","suitability":"strong"},{"surface":"BOBULE","suitability":"strong"},{"surface":"JAHODA","suitability":"strong"},{"surface":"BOTANICKY","suitability":"strong"},{"surface":"NENÍ","suitability":"strong"}],"companions":[{"text":"je","revealWith":"BOBULE","significant":false}],"expectedValidation":"pass","source":{"status":"verified","label":"McGill Office for Science and Society","url":"https://www.mcgill.ca/oss/article/did-you-know/bananas-are-berries-raspberries-are-not"}},{"id":"tajenka-v2-c20","candidateNo":20,"category":"fact","displayText":"Kočky sladkou chuť prostě necítí.","immutable":false,"anchors":[{"surface":"KOČKY","suitability":"strong"},{"surface":"SLADKOU","suitability":"strong"},{"surface":"CHUŤ","suitability":"strong"},{"surface":"PROSTĚ","suitability":"strong"},{"surface":"NECÍTÍ","suitability":"strong"}],"companions":[],"expectedValidation":"pass","source":{"status":"verified","label":"PubMed PMID 16772462","url":"https://pubmed.ncbi.nlm.nih.gov/16772462/"}},{"id":"tajenka-v2-c21","candidateNo":21,"category":"fact","displayText":"Saturn má průměrnou hustotu menší než voda.","immutable":false,"anchors":[{"surface":"SATURN","suitability":"strong"},{"surface":"PRŮMĚRNOU","suitability":"strong"},{"surface":"HUSTOTU","suitability":"strong"},{"surface":"MENŠÍ","suitability":"strong"},{"surface":"VODA","suitability":"strong"}],"companions":[{"text":"má","revealWith":"PRŮMĚRNOU","significant":false},{"text":"než","revealWith":"VODA","significant":false}],"expectedValidation":"pass","source":{"status":"verified","label":"NASA Science","url":"https://science.nasa.gov/saturn/facts/"}},{"id":"tajenka-v2-c22","candidateNo":22,"category":"fact","displayText":"Včely tancem ukazují směr k potravě.","immutable":false,"anchors":[{"surface":"VČELY","suitability":"strong"},{"surface":"TANCEM","suitability":"strong"},{"surface":"UKAZUJÍ","suitability":"strong"},{"surface":"SMĚR","suitability":"strong"},{"surface":"POTRAVĚ","suitability":"strong"}],"companions":[{"text":"k","revealWith":"POTRAVĚ","significant":false}],"expectedValidation":"pass","source":{"status":"verified","label":"Smithsonian Institution","url":"https://www.si.edu/object/10-incredible-facts-about-honeybees%3Ayt_3cfNbbrXOAc"}},{"id":"tajenka-v2-c23","candidateNo":23,"category":"fact","displayText":"U mořských koníků rodí mláďata samci.","immutable":false,"anchors":[{"surface":"MOŘSKÝCH","suitability":"strong"},{"surface":"KONÍKŮ","suitability":"strong"},{"surface":"RODÍ","suitability":"strong"},{"surface":"MLÁĎATA","suitability":"strong"},{"surface":"SAMCI","suitability":"strong"}],"companions":[{"text":"U","revealWith":"MOŘSKÝCH","significant":false}],"expectedValidation":"pass","source":{"status":"verified","label":"Smithsonian Institution","url":"https://www.si.edu/object/yt_Mb89JUB7atM"}},{"id":"tajenka-v2-c24","candidateNo":24,"category":"fact","displayText":"Hlemýžď má v tlamě tisíce drobných zubů.","immutable":false,"anchors":[{"surface":"HLEMÝŽĎ","suitability":"strong"},{"surface":"TLAMĚ","suitability":"strong"},{"surface":"TISÍCE","suitability":"strong"},{"surface":"DROBNÝCH","suitability":"strong"},{"surface":"ZUBŮ","suitability":"strong"}],"companions":[{"text":"má v","revealWith":"TLAMĚ","significant":false}],"expectedValidation":"pass","source":{"status":"verified","label":"Natural History Museum of Los Angeles County","url":"https://nhm.org/stories/microscopic-look-snail-jaws"}},{"id":"tajenka-v2-c50","candidateNo":50,"category":"fact","displayText":"Motýl poznává chutě pomocí nohou.","immutable":false,"anchors":[{"surface":"MOTÝL","suitability":"strong"},{"surface":"POZNÁVÁ","suitability":"strong"},{"surface":"CHUTĚ","suitability":"strong"},{"surface":"POMOCÍ","suitability":"strong"},{"surface":"NOHOU","suitability":"strong"}],"companions":[],"expectedValidation":"pass","source":{"status":"verified","label":"Washington State University","url":"https://askdruniverse.wsu.edu/2026/07/16/butterflies-taste-feet/"}},{"id":"tajenka-v2-c51","candidateNo":51,"category":"fact","displayText":"Sovy nehýbou očima, proto otáčejí hlavou.","immutable":false,"anchors":[{"surface":"SOVY","suitability":"strong"},{"surface":"NEHÝBOU","suitability":"strong"},{"surface":"OČIMA","suitability":"strong"},{"surface":"OTÁČEJÍ","suitability":"strong"},{"surface":"HLAVOU","suitability":"strong"}],"companions":[{"text":"proto","revealWith":"OTÁČEJÍ","significant":false}],"expectedValidation":"pass","source":{"status":"verified","label":"Smithsonian Q?rius","url":"https://qrius.si.edu/taxonomy/term/12125"}},{"id":"tajenka-v2-c52","candidateNo":52,"category":"fact","displayText":"Kolibříci umějí létat také pozpátku.","immutable":false,"anchors":[{"surface":"KOLIBŘÍCI","suitability":"strong"},{"surface":"UMĚJÍ","suitability":"strong"},{"surface":"LÉTAT","suitability":"strong"},{"surface":"TAKÉ","suitability":"strong"},{"surface":"POZPÁTKU","suitability":"strong"}],"companions":[],"expectedValidation":"pass","source":{"status":"verified","label":"Smithsonian National Zoo","url":"https://nationalzoo.si.edu/migratory-birds/hummingbirds"}}]}
